category,date,contents,title
모두의공원,2016-10-15,"네 ,지점가서 등록했고 통화음질도좋네요from CV 뭐라그러면서 등록해야되나요 ㅜㅜ 아직 못가고있는데 그냥 단말기등록하러 왔다고 하면 될까요 카메라가 손떨림방지 기능이 없어서 구매보류했던 기억이...",<span>샤오미맥스 가성비최고네요!</span>
모두의공원,2016-10-15,"교환하라고 ,에서 문자가 왔기에 저도 다음 주말에 교환 예정인데요 솔직히 노트7 정말 좋은 폰이고 바꾸기 싫은데 진짜 잘못된 상황이 언제라도 나올 수 있는 폰이니 시간이 있으면 가장 먼저 바꾸는 게...",<span>노트7쓰는 사람이 민폐인이 되었네요</span>
모두의공원,2016-10-14,"라이트 사용중인데 속도 잘 나오네요 +_+ 기가라이트는 사랑입니ㅏㄷ. 오 업로드 속도도 잘나오네요 저도 오늘 kt 기가 설치했어요 480정도 나오더군요 from CV , 동축망은 다운 480 업 4 였던게 작년이네요 ㅋㅋㅋ",<span>기가 <b>인터넷</b> 속도 인증 !</span>
모두의공원,2016-10-13,"진짜 ,만 아니면 더러워서 KT쓰기 싫은데 ㅜㅜ 설치하러온 기사님도 대신 사과드린다네요...자기도 KT운영방식에 상당히 문제가 많다고 생각한다며... 방통위 민원이 직방입니다.... 지금 통화내용 다 녹음...",<span>KT 그냥 배째라네요.</span>
모두의공원,2016-10-13,"어떡합니까. 렙업하고 오세요!! 이번달 초에 ,문제로 올레에 전화했었는데 1회차. 신호 새로 보냈고요...다시전화했더니 손쉽게 해결... 상담은 진짜 ,가 최고인거 같아요...저번에 ,갤포아 KT에서...",<span>KT 상담사분들은 일하고자 하는 의지가 전혀 보이지가 않네요.</span>
모두의공원,2016-10-12,"본인이 ,을 사용하지 않더라도, 앱에서 1byte라도 데이터를 전송하면 카운트가 들어갑니다. 그 때부터 24시간 단위로 하루로 계산합니다. 그래서, 항상 사용하지 않을 때는 데이터 로밍을 비활성화...",<span>KT가 오랜만에 뚜껑 열리게 하네요</span>
모두의공원,2016-09-30,"ㅋ 심재학이랑 같이 간다고 ㅋ이미 계약까지 다 해놧을겁니다 아앙대 염감...ㅠfrom CV 염감독 ,이적얘기는 , 방송에서 장강훈,석주일이 얘기했었죠 염감 이적설은 석주일이 떠들었는데 이후 장강훈이...",<span>[비하인드 베이스볼] 감독 이동을 둘러싼 흉흉한 소문들</span>
모두의공원,2016-09-29,"며칠전 부터 ,브로드밴드에서 꾸준히 이시간에 전화가 오길래 뭔가해서 오늘 받아봤더니.. 고객님께서 꾸준히 이용해주시는 감사의 의미로 , 속도점검을 무료로 해준다고 합니다. 그래서 그러라고...",<span><b>SK</b>브로드밴드 짜증 나네요</span>
모두의공원,2016-09-28,"지난 수개월간 한국증시는 대형주 중심으로 흘러왔습니다. 삼성전자를 필두로, ,하이닉스등 IT대표주와 네이버, 엔씨소프트 등 , 대표주, 그외에도 시총순위 탑10중 삼성물산, 현대모비스도 상승폭이...",<span>[주식]펀드매니저도 받아보는 아침 주식시황 9/28 : 클리앙</span>
모두의공원,2016-11-10,"제가 skt라서 결합할인이 싸서 그냥 쓰고 있긴 한데, 둘이 입을 모아 얘기합니다. 약정끝나면 , ,, 전화는 절대 쓰지 말자고. w.ClienS malu7님헛! 살아있는 답변이군요 ㅋㅋ참고할게요 ㅋㅋㅋ...",<span>현재 <b>인터넷</b>+TV 결합상품 알아보고있네요...jpg</span>
모두의공원,2016-11-07,"텔레콤이 사물,(IoT) 전용망인 ‘로라’를 활용한 아동용 위치추적 서비스인 ‘지퍼’(Gper)를 출시했다고 7일 밝혔다. 일반 소비자를 대상으로 로라망 상품이 나온 것은 처음이다. 성냥갑만 한 기기를 아이...","<span>SKT, IoT 전용망 ‘로라’ 기반 위치추적기 ‘지퍼’ 출시</span>"
모두의공원,2016-11-07,"텔레콤이 사물,(IoT) 전용망인 ‘로라’를 활용한 아동용 위치추적 서비스인 ‘지퍼’(Gper)를 출시했다고 7일 밝혔다. 일반 소비자를 대상으로 로라망 상품이 나온 것은 처음이다. 성냥갑만 한 기기를 아이...","<span>SKT, IoT 전용망 ‘로라’ 기반 위치추적기 ‘지퍼’ 출시</span>"
모두의공원,2016-11-04,"전쯤부터 5년전까지 U+썻었는데 그때도 특정시간(,사용시간 몰릴때) 같은경우 속도저하 현상있더니...달아직안됬는데 위약금물고라도 해지하고 다시 ,나 KT 넘어갈까 봐요. 쓰레기 U+ 그건 skb도...",<span>U+ 속도저하현상 몇년지나도 안없어지는군요</span>
모두의공원,2016-11-04,"공유기를 구매해야겠네요. 기가,은 비싸서 ㅠ 100m 사용중인데. 공유기가 너무 안좋아요!!!! , 엘티이 속도도 ㅆㄹㄱ ＊ 프로폴리스님// 저희집은 kt가.. 전화가 안터져서.. 딴 얘기지만 ...엘지는 장소...",<span><b>sk</b>와이파이는 ㅆㄹㄱ네요.jpg</span>
모두의공원,2016-11-04,"어제 ,통화했을때 가능하다고 했는데 아닌갸요?공기기로 기변하고 타기기로 유싱기변 가능하다고 했는데 안되나봐요?from CV 첫댓글 처럼 선택약정 유심기변은 선택약정 가능한폰에만 가능한걸로 알고있슴돠...",<span>s7e다시 되팔아야 하나 고민되네요 ㅠ</span>
모두의공원,2016-06-29,"갑자기 , 창에 ,공유서비스 가입하리고해서 고객센터에 물어봤더니 하루마다 맥 어드레스 기록해서 3대 사용이 감지되면 ,이 막히는 구조라네요. 가입약관에 써있다고 이야기 하니 뭐 더 할말도...",<span><b>sk</b>가 피씨 3대 사용이 불가능이었군요.</span>
모두의공원,2016-06-27,"통신비가 만만치 않아서 쉽게 바꾸질 못하겠네요.. ,엔 10만원이네 15만원이네 kt기변이 싸네 어쩌네 해도 다른세상 이야기인가 봅니다.. 더욱이 ,는요..ㅜ ㅜ from CV 저도 기변이라 걍 정가에 삽니다...",<span>기변증 걸려서 노트5에서 7엣지 로 가고 싶은데..<b>sk</b>기변은 답이 없네요.</span>
모두의공원,2016-06-22,"LG 쓰면서 만족하고 있고 예전에는 가장 좋다는 평이었는데, 요즘은 어떤가요? ,에서 전화와서 자기들이 고객만족도 1위라고 홍보하네요.. 물론 google movie 때문에 LG에서 벗어나기 힘들거 같긴 합니다만..",<span><b>인터넷</b>TV <b>SK</b> vs KT vs LG</span>
모두의공원,2016-09-02,"솔직히 ,도 하기 힘든 수준입니다... 포켓파이 초기버전 사용자입니다 이제 거의 1년되어가는거 같기도 하고... 출시되고 한달안에 샀던거 같습니다 만족도는 높습니다. 오히려 태블릿 활용도가...",<span>포켓파이 M 한달 10기가 데이타 꽁짜로 쓰네요</span>
모두의공원,2016-08-29,"개인적으로 ,망을 선호하므로.... 요약을 하자면, 딱히 각 통신사 멤버십이나 결합할인(온가족포함)에서...요금제(38,500원)가 나을 것 같음. 나름 멤버십 혜택도 많이 찾아쓰는 편이고, TV나 집전화, , 등",<span>5~6기가 데이터 요금제 비교분석 (알뜰폰도 포함) : 클리앙</span>
모두의공원,2016-08-26,"컴퓨터를 규정 댓수보다 많이 사용하고 있다면서 , 제한을 걸어버리네요..ㅎ 예를 들어 데스크탑 2대, 노트북 2대가 있다면 총 4대의 컴퓨터를 쓰고 있다는 거에요. ㅋ 그 중 동시 접속이 2대뿐일지라도...",<span><b>sk</b>브로드밴드 웃기네요.</span>
모두의공원,2016-08-26,"얘기를 ,에서 봤는데..... 바로 풀리네요..... 다만 대리점 방문해야 하는건 ㅠㅠ 참고로 skt 는 홈페이지의 확벙기변 메뉴에서 처리 가능합니다.... 유플러스는 그냥 심 바꿔도 된다고 어베 리플 본듯...",<span>kt 선택약정 기기바꿨습니다. 기존 기기는 락 안걸리고 바로 풀어주네요...</span>
모두의공원,2016-08-24,"기가 업글도 겸사 겸사할까 했는데, 하면 또 , 부분은 할인이 안먹고 티비할인만 해준다네요(!?) 결국...업글(컴팩)만 하고 말았네요. 어머니랑 저랑 ,가 20/15년짜리라 옮길 때 걍 ,에 다 결합...",<span>kt 재약정은 조건이 좀 별로군요(<b>인터넷</b>)</span>
모두의공원,2016-08-06,"제 회선 삼촌 회선(어쩌다보니... ㅋ) 이렇게 20년이 되서 30프로를 받고 있는데... 할머니 명의로 ,을 아부지 집에서 사용중입니다. (복지 할인으로 30프로 받고 있는데..) 이게 벌써 8년은 넘은거...",<span>지금 온가족 30프로 받고 있는데... 50프로를 위해 <b>인터넷</b> 명의를 바꿀까 고민입니다.</span>
모두의공원,2016-08-05,"안좋더군요 ㄷㄷ 신도림 가도 당장은 온가족 50프로 못 받으실겁니다 ㅠ 몇개월 써야되여#CLiOS 이미 , 걸려있는게 있어서 12월까진 온가족으로 못갈거 같아요 :( 그나마 SKT 기변 조건이 가장 좋아요. 엥...",<span>역시 <b>SK</b> 기변은 헬이군요 ㅜㅜ</span>
모두의공원,2016-08-04,"괜히 , 슈퍼폰 소리듣는게 아니에요. 출시하고 얼마안가 그 거품이 싹 빠지고 실구매자들의 불만만 남죠. 옵티머스 LTE2 때부터 이어져 오는 일이고 이제 사람들이 속지 않는겁니다. Youtube님저는 오히려...",<span>국내에서 초기 이슈 없는 스마트폰은 단연코 없었습니다</span>
모두의공원,2016-08-03,"중이다 보니 업무하는 척,작성해보겠습니다. 1) 현황 본인 : 핸드폰 ,, ,&IPTV : LG 가족 : 핸드폰 ,, ,&IPTV : , - 제 ,&IPTV를 제외하고는가족 모두, 묶어서 사용 중입니다. 2) 재약정...",<span>업체간 <b>인터넷</b> 재약정 관련 차이</span>
모두의공원,2016-08-03,"엣지샀다가 너무 불편해서 바로 갈아탄 기억에 그냥 플랫으로. 이참에 ,이랑 BTV도 전부 KT로 갈아 타야 겠네요.. 나한테 해준게 없는 ,지만 워낙 오래써서 그런지 아쉽긴합니다. 백업 중이라 아직 실사...",<span>노트가 흥하는 중 S7 구매</span>
모두의공원,2016-10-09,"엑스포하는 ,엑스포 한국관도 운영했고 할 수있는건 다했어요. 저는 ,에 대한 종이로 된 잡지를...것이 맞습니다. 그게 1999년도에 하나로통신(,브로드밴드)이 세계최초로 상용화했습니다. 두루넷...",<span>초고속<b>인터넷</b>을 메가패스로 보느냐 isdn으로 보느냐 차이겠지만</span>
모두의공원,2016-10-07,"https://youtu.be/,2hthN-mns public servant 공무원, 공복(公僕)(cf. PUBLIC OFFICER); 공익 법인, 공사 공인의 정의에 대한건 , 초창기부터 계속 보던건데, 논란은 무한반복인듯 해요... 공인을 어떻게...","<span>김제동 ""도대체 공인이 누굽니까?"" (feat. 이재명)</span>"
모두의공원,2016-09-26,"이게 한방에Home 2로 바뀌면서 재가입도 안되고..,과 모바일을 나눠서 할인만 받을 수가 있게 되어...다른통신사로 옮길지 고민이 되네요 ㅋㅋ ,나 KT로도 묶으려면 묶을 수 있는 상황이라 ㄷㄷ...",<span>유플러스 <b>인터넷</b> 할인 받고 있는 것 때문에 번호이동이 골치 아프네요 ㄷㄷ</span>
모두의공원,2016-09-24,"배필4때도 그렇고,,, 오바와치도 주말이라 그런지 다른사람들은 안그러는데 저만 심하게 접속이 끊기고 게임내에서도 렉현상이 심하네요,,,,,",<span><b>sk</b><b>인터넷</b>으로 오바와치하기 힘드네요</span>
모두의공원,2016-09-22,"놓고 치열한 각축전이 벌어지고 있는데요. 현재 4위 ,하이닉스 28.7조, 5위 네이버 28.6조, 6위 현대...등락에 따라 엎치락 뒤치락입니다. 반도체냐, ,이냐, 자동차부품이냐(+재벌지배구조). 큰 의미는...",<span>[주식]9월 22일 마감시황 및 이슈 : 클리앙</span>
모두의공원,2016-09-22,"집에서 , ,과 TV를 모두 이용하고 있습니다. 요즘 속도가 좀 느려서 컴플레인 해야 하나 하고 있었는데 전화가 왔네요. 우리동네 설치를 담당하는 업체인데 속도저하 민원이 잦아서 땅파서 선을 확인해보니...",<span><b>인터넷</b> 회사에서 통신사 이동을 하라고 하네요. : 클리앙</span>
모두의공원,2016-09-20,"느립니다. 속 터집니다. 오늘 좀 메롱메롱하네요. 풀기가 인데 평소 그대로입니다. DNS 바꿔보세요 요 근래 ,/KT DNS 장애가 꽤 잦습니다. 구글 DNS 추천. 저만 그런 게 아니었군요!이상하게 느려져서 껐다 켜니...",<span>KT<b>인터넷</b> 쓰시는분들 <b>인터넷</b> 안느리세요?</span>
모두의공원,2016-09-20,"홈페이지 요금제를 뒤져보는중인데... 기본 데이터 조금 포함해서 2만원 중후반대가 나오네요. 집에 ,도 ,고 그외전화도 다 알뜰폰이어서 결합할인 할 건덕지도 없는데...-_-;;; 정말 욕음제라는 말이...",<span>전화 요금제 데이터가 붙으니 확뛰네요.</span>
모두의공원,2016-10-31,"http://m.news.naver.com/read.nhn?mode=LSD&mid=sec&sid1=105&oid=277&aid=0003859680 , ,으로도 만족하시면 그냥 넷츠고 쓰시는걸 권유하고 싶지만 지금은 없어진 회사라 아쉽네요. 넷츠고!!! 고객센터...",<span><b>sk</b> 이너넷 국가호갱만족도 1위 6년이시군요</span>
모두의공원,2016-10-30,"와도같은 글이지요 ＊ 수도권에서는 잘보이나여? 지방이라서 그런지 안보이네요..이런데서도 차별을 받다니... , ,입니다 .. 안보이네요케이티 보이나요? 이미 다 드셨답니다.. 글 내려주세요#CLiOS 불판이...",<span>v20 카메라 테스트입니다.</span>
모두의공원,2016-10-29,"명이 ,으로 보는 가운데 게임을 할 거라고는 상상도 못했다. 중학교를 다니던 2011년 LoL을 처음 알게 되었다. 어떻게 보면, 정말 빠른 속도로 배우고 습득했다. 어린 아이때 부터 프로 스타크래프트를...",<span>LOL] 플레이어 트리뷴지에 기고문을 올린 페이커</span>
모두의공원,2016-05-22,"이런것 같은데 밤 시간대부터 새벽대에 항상 ,이 끊겼다가 다시 되고 반복하고 요즘은 아예 랜덤적...것 같고요. 혹시 저희 집만 이런가 해서 고민 호소해봅니다... 그리고 ,가 원래 이렇게 느린가요 ㅠㅠ",<span><b>SK</b><b>인터넷</b> 이런 문제 겪고 계신분 없나요 : 클리앙</span>
모두의공원,2016-05-19,"있습니다. 신축빌라라면 통신함에 모뎀을 넣어야 할텐데.... 경우에 따라선 KT 기가, 2회선만 쓰고 , 기가,은 해지해야할 듯 싶네요. 3회선을 못쓴다면.... 혹시 .. 회선을 여러개 쓰시는 이유...",<span>모뎀 성애자 입니다.</span>
모두의공원,2016-05-18,"모자이크처럼 화면 깨져나오고 했습니다.. ,도 특히 업로드가 너무 느려 밖에서 시놀로지 나스에 있는...어차피 약정도 끝난지 한참인데 아예 ,로 바꿀까? 하길래 알라보라고 했습니다.. 그런데...",<span>유플에서 도청 장치를 달아놨는지.. ㄷㄷㄷ : 클리앙</span>
모두의공원,2016-05-17,"이제 기가,을 쓸때가 된거 같아요... 저도 8월에 만료더라구요... 어떻게 갈아탈야할지 고민됩니다.. ,로 갈아탈려고 대기중입니다 온가족할인 노예라 대안이 없어요ㅜㅜ 전 내년 4월이네요 그지 같은...",<span>3년만에 오는 쿨타임이 왔습니다.</span>
모두의공원,2016-06-18,"LG ,ㆍ통신 계열사에 입사했다. 그러다 2004년 LG파워콤에 영입됐다. A씨를 점찍어 데려온 그 회사 임원은 2006년 대표이사에 올랐고, A씨는 신임을 받으며 승승장구했다. 이어 2010년 LG텔레콤이 LG파워콤...",<span>LG가 안 되는 이유중 하나랄까요...</span>
모두의공원,2016-06-12,"요는 , 기가라이트 설치를 그저께 했고, 벤치비나 기타 속도 테스트에서는 450Mpbs 정도 꾸준히 잘...문제 없는데 실제 다운로드 속도만 제대로 안나온다네요. 즉 포기하고 그냥 가셨습니다...;; 역시 ,은",<span><b>sk</b> 기가라이트... 실망스럽네요...</span>
모두의공원,2016-06-11,"은 대학생 특가로 현재 17000원 ,에서 이용하고 있습니다 약정은 끝나서 해지를 언제든지할수 있는데 보통 ,하고 티비 묶어서 얼마정도면 저렴한건가요? 지역 케이블에서티비만 기본 채널로 신청...",<span>집을 이사가는 바람에 티비를 설치해야하는데 어렵네요..</span>
모두의공원,2016-06-11,"조사받느라 사리는 사이에 KT가 엄청 달리는 중입니다 ,는 따라가기 바쁘네요 ㅋㅋ 6월한달 이런 기조일듯...부모님 폰바꿔드려야 하는데 좋은 조건 찾기가 어렵네요. ㅜㅜ , 좀 찾아보면 정보 있을꺼에요",<span>오늘 올라온 카톡 메세지...하~~ 기변증 ㅠ</span>
모두의공원,2016-06-10,"별 문제없이 잘 하고계시는 분위기... ㄱ-;; 그래서 , 한번 바꿔봤습니다. KT가 해외망 젤 괜찮다 + PS4 갖고 놀다보면 해외겜 많이 할테니 + , 약정도 끝났으니 겸사겸사 + NAS도 쓰니까 기왕이면...",<span><b>인터넷</b>을 바꿨더니 게임 랙이 사라졌습니다.</span>
모두의공원,2016-08-24,"화가 나셨는지 그쪽꺼 안쓰신다고 하고 통신사를 바꾸 셨는데... 전화만 통신사 이동(,)이 되고 티비랑 ,은 ,에서 새로 신청한 걸로 돼버렸나봐요. 중간에 이사도 한번 하셨는데 이사하면서도 기존...",<span>유쁠한테 2년동안 그냥 돈만 갖다 바쳤군요... ㅠㅠ</span>
모두의공원,2016-08-23,"광랜이 안되고 비대칭 서비스만 가능하다는군요 ㅠㅠ 다운 100메가 업 10메가.. 업로드 할 일이 별로 없기는 하지만 같은 요금에 왠지 손해보는 느낌이에요. 남은 약정기가 1년만 더 쓰고 kt나 ,로 옮겨야겠습니다.",<span>이사가는 집에 유플러스 비대칭 <b>인터넷</b>만 된다네요</span>
모두의공원,2016-08-23,"이미 ,만 잘 찾아보면 위성지도 얼마든지 찾을 수 있습니다. 안보 논란은 무의미한 거죠... 현재 google.com에서 보이는 위성지도에 이미 중요 정보가 다 노출되어 있지 않나요? google.co.kr만 저해상도...",<span>구글 지도 문제가 안보문제도 같이 있습니다</span>
모두의공원,2016-08-19,"원래 기가비트 공유기가 있는데 현재 제 명의 ,을 형이 사용중이라 지금 사는곳에 100m ,을 사정상 임시로 달았습니다. , 100m 무약정을 사용중인데 공유기가 Wifi용이 아니라서 앱 다운받을때...",<span>만원 짜리 공유기 샀는데 생각보다는 만족스럽네요</span>
모두의공원,2016-08-19,"초과시 차단, KT는 과금…SKT만 무제한 제공 http://news1.kr/articles/?2463114 ,텔레콤과 다르게 KT와 LG유플러스가 초고속, 사업을 하기 때문에 테더링을 제한하는 것이라는 관측도 있다. 이통업계...",<span>데이터무제한에서 테더링시 과금은 통신사마다 다릅니다</span>
모두의공원,2016-07-31,"텔레콤, KT, LG유플러스 이동통신 3사가 새로운 모바일-, 결합상품을 내달 1일부터 출시한다. 종전 3년 약정 조건을 1, 2년 대상자로 확대하고, 여러 명이 나눠 받던 할인을 한 사람에게 몰아주는 등...","<span>이통 3사, 新 결합상품 출시...SKT&gt;KT&gt;LGU+ 順</span>"
모두의공원,2016-07-29," :http://www.sktcoverage.com KT :http://coverage.olleh.com/ollehIntro U+...터지는지 상세하게 알 수 있습니다. (3G, 와이파이, ,도 조회 가능) 전 사무실~집~놀이터(?) 경로에서 ,만 3밴드...",<span>어제 최초로 LTE 커버리지 맵이 발표됐었군요.</span>
모두의공원,2016-07-28,"9년간 근무하다 2012년 화웨이로 옮겼다. 이뿐만 아니라 ,과 게임 분야의 젊은 엔지니어들도 줄줄이 해외로 떠나거나 이직을 준비하고 있다. ,그룹의 한 CEO는 ""요즘 공대생의 취업 1순위는 구글, 2...","<span>""빨리빨리, 시키는 대로"" 쪼아대니… R&amp;D인재 韓國 등진다</span>"
모두의공원,2016-07-24,"속도가 느리고 폰도 바꿀때가 됐다싶어 며칠간 , 폰 판매 게시판 검색해서 오늘 신청했네요. skt망을...가입비 및 유심비가 공짜라서 좋더군요. ,망을 써서리 티맵이나 t 와이파이도 쓸 수 있어 맘...",<span>3년만에 Nexus 5X 32G로 폰 바꿨습니다.</span>
모두의공원,2016-10-05,"현재 2회선 온가족 무료 결합에 BTV 추가해서 , / BTV 스포츠채널 나오는 상품으로 한달에 23000원쯤...게 나을거 같아서 1차 해지방어 해봤습니다. ,에 전화해서 해지담당 부서로 연결해달라고 해서...",<span>SKT 온가족무료 해지방어 1차 시도</span>
모두의공원,2016-10-05,"하나, 카드사 채무면제 유예상품 해지 번호: 1599-3323 특히 본인도 모르게 채무변재 유예상품 가입 동의 하신분들 꽤 쏠쏠하게 받으실수있습니다. 현대카드 및 몇 카드사는 기일이 오늘까지라고하네요.. 직통...",<span>[환불받으세요] 나도 모르는 카드사 채무면제 유예상품 가입</span>
모두의공원,2016-04-24,"앱 거진 안되고, 멜론 로그인도 안되고, , 관련앱 안되는거 천지고, mx 플레이어도 안되서 vlc로 하느라...하시면.... 커서 싫대요 ㅋㅋㅋ from CV 여보 ,보니까 g3 공짜던데 그걸로 바꿀래? #CLiOS",<span>마눌께 넥6P 돌아가는게 없어 힘들다 시전중입니다</span>
모두의공원,2016-04-23,"바로 옆동은 설치가능하든데 ㅠ 저희 동은 라이트도 안되고 ㅁㄴㅇㄹ.... 요새 ,이 느린 느낌인데 공유기가 맛이 간건지 ㄱ= 에휴!",<span>저희 동은 <b>SK</b> 기가<b>인터넷</b> 설치불가 지역이네요 ㅠ</span>
모두의공원,2016-04-22,"경우, 서비스 이용이 제한 될 수 있습니다. 이는 , 카페 등을 통한 거래 시, 고객 정보 유출로 인한...4기가씩 판매가 되나요?? 아 1회선당 2기가요~ 아 , 2회선쓰신거였군요??? 제가보기엔 그냥 책임...",<span>이때쯤 skt 데이터 선물하기 약관이 바뀐다 했는데 말이 안나오네요</span>
모두의공원,2016-09-19," , 물린 와이파이 공유기 사용중입니다. 카카오톡 종이비행기만 떠있네요 지역은 성남시 분당 판교입니다 from CV",<span>카톡 또 멈춘건가요? : 클리앙</span>
모두의공원,2016-09-19,"맨날 그 던전에 그 던전에다가... ios10에 준비 대응할 시간이 충분 했는데도 불구하고 이러는거 보면 당체 뭐하는 사람들인가 싶네요. 티비랑 , 노예계약 끝나면 ,나 유플로 갈아타던가 해야겠네요. #CLiOS",<span>올레 KT는 졍말 데단하네요..!</span>
모두의공원,2016-09-14,"#CLiOS kt쪽은 안되는것 같습니다. 혹시 KT망이시면 ,망으로 해보세요. 저도 업데이트 한참 안돼서 ,망...보니 잘되네요 ㅠㅠ w.ClienS 저는 집에서 KT,을 이용하여 아이튠즈로 하는데 업데이트 하는데...",<span>애플 서버들이 맛이 갔나보군요.</span>
모두의공원,2016-09-14,"저도 2일 나왔는데 ,에서 잘된다는 댓글 보고 ,망에서 하니 5분만에 끝났네요 ㅠㅠ w.ClienS 큰별폭탄님...,망으로 어떻게 접근하나요? 저는 현재 KT,을 사용하는데 전환하는 방법이 있으면 알려...",<span>ios 업뎃 잘들 되시나요?</span>
모두의공원,2016-09-11,"다음달 10월에 3년약정 ,브로드밴드 ,+IPTV 서비스가 만기종료가 됩니다. 현재 월 2만원가량 내고 있구요. 이거 끝나면 이렇게 바꿀 계획입니다.. 휴대폰 알뜰폰 EG399 요금제 (통화+데이터+문자 완전...",<span>저의 통신비 줄이기 계획안입니다.</span>
모두의공원,2016-03-18,"오늘 , 끊김으로 고객센터와 3번의 통화 끝에 저희 지역 전체적인 문제임을 알았습니다. 지역 관리센터에서도 전화가 왔는데 이상패킷이 감지되어 현재는 안정화 되었답니다. ㅠㅠ 혹시 금암동에 계신분...",<span>경기 오산 <b>SK</b> 브로드밴드 <b>인터넷</b> 끊김 로그 : 클리앙</span>
모두의공원,2016-10-29,"명이 ,으로 보는 가운데 게임을 할 거라고는 상상도 못했다. 중학교를 다니던 2011년 LoL을 처음 알게 되었다. 어떻게 보면, 정말 빠른 속도로 배우고 습득했다. 어린 아이때 부터 프로 스타크래프트를...",<span>LOL] 플레이어 트리뷴지에 기고문을 올린 페이커</span>
모두의공원,2016-05-17,"많이 들었는데 lgt꺼는 그래도 쓸만한것 같아요 ,는 뭔가 사람들이 너무 많이 써서 미어터지는 느낌...from CV 클리앙 글보기 네이버 글보기 , 라디오 든기에는 충분하죠~ gif는 무리지만 사진도...",<span>저는 LGU+가 더 낫더라구요</span>
모두의공원,2016-05-15,"해도 엄청 느렸거든요.. 지금은 언제 그랬냐는 듯이... lg만 캐시서버가 있었는데 ,와 kt도 설치를 해서 나아진거지요 아. 역시 이유가 있군요. kt기가, 사용중인데 안끊기던 유튜브가 최근들어 끊기던데요",<span>유투브가 이제는 끊기지 않네요..</span>
