category,date,contents,title
모두의공원,2014-06-09,"아 정말.. LTE는 U+인 진리인가요....ㅠㅠ 1. U+베레기 2. 노트2-KT 3.노트2-,입니다만.....베레기가 가장 빠른것...같아요..,속도가요.. 그냥 웹브라우저로도 모든기능 다 됩니다. 지금 장애...",<span>올레 고객센터 앱 아주그냥 미칠것같아요</span>
모두의공원,2014-06-06,"클량도 마찬가지죠#CLiOS 하늘나루님//삼성에서 국내 , 상에 알바 동원했다는 구체적인 증거가 없네요...동원할 필요는 없어보입니다 전에 클리앙에서 엘지 바이럴 하는거 저도 잡아 냈었죠.,나 삼성도 많죠","<span>시코, lg알바 적발한적이 있군요 ㄷㄷ</span>"
모두의공원,2014-05-26,"에서 모바일로 넘어가는 상황에서 한발늦은 다음이 초강수를 날렸네요 ㄷㄷㄷ 점차 다양한 웹콘텐츠...봐도 그렇고 음.... 그나저나 이렇게 될수록 , 컴즈 (라 쓰고 skt의 압박이라 읽음)삽질은...",<span>다음의 카카오 인수 신의.한수군요 ㄷㄷㄷ</span>
모두의공원,2014-05-25,"이 활성화될 때(윈도우95시절)부터 쭉 지켜보면 초기에는 모두 야후가 차지했고 기타 라이코스, 심마니 등도 종종 있었는데 야후를 밀어내고 차지한 것이 엠파스 엠파스가 네이버에 밀리고 지금상태가 된...",<span>공공기관 컴퓨터의 시작페이지를 보면 다음이 메인으로 있었던 적은 없었던 것 같아요.</span>
모두의공원,2014-05-23,"안드폰을계속쓰다가바꾼지라 비교가되네요. 카메라나 ,은 완벽한데 통품이랑 어플팅김은 아이폰이 좀 더하단 느낌이 드네요. with ClienS imperator님 , 노트3 아이폰5s 같이 사용중인데 수신율은...",<span>아이폰으로 clios 불편하네요.</span>
모두의공원,2014-05-21,"몇년동안 , , 사용하다가 월요일날 KT ,+올레TV 로 바꿨습니다. 짜증나는게... 그날 저녁에 상담원이라고 남자가 전화와서 왜 바꾸냐 등등 자꾸 말해서 회의중이고, 이미 결정난거니까 전화주지...",<span><b>SK</b>브로드밴드 <b>인터넷</b> 짜증나 미치겠네요.</span>
모두의공원,2014-05-21,"그게 저기 수치에 반영된거인지는 모르겠지만.. , lte 쓰다가 하도 생방 많이보는데 끈켜서 열받아서 lg로...비오는 날에... 수서역에서 판교쪽갈때 가끔 ,이 끈기긴 하는데... 그러고 보내 제 핸드폰...",<span>유플러스는 의외로 충성고객층이 많나봐요?</span>
모두의공원,2014-05-20,"집에 ,하고 핸드폰 결합 KT 결합이 되어 있어요ㅠㅠ 이제 일년 조금 넘어서 해지 비용도 장난아니고 SKT 로 돌아가고 싶어요!!!",<span><b>sk</b>로 갈아 타고 싶지만...ㅠㅠ</span>
모두의공원,2014-04-17,"따지지말고 그냥 아버지폰바꿔드릴까싶네요 ㅠㅠ(참고로 저희아부지 kt 80개월넘게사용중이십니다) , 오래된회선 살려고했는데 찾아보니 직접만나서 인수인계하는거 아니면 한쪽 이름이나 주민번호가 노출...",<span>갤5 kt 기변 요금제자유인곳 찾았네용</span>
모두의공원,2014-04-16,"넥센 , 두산의 분위기가 요즘 참 좋습니다. 반면에 엘롯기는 하위권에서 다시 뭉칠 분위기... from iPad Air-ClienKit-Logitech UK 오늘 롯데는 경기중에 앰프로 '뱃놀이'를 틀었습니다...-_-.... 이걸로...",<span>야구. 올해는 왠지 엘롯기가 다시 뭉칠 분위기</span>
모두의공원,2014-04-16,"브로드밴드 3년약정이 얼마전에 끝나서 현재 요금은 19000원 정도 나옵니다. (,만. Btv는 안봐서;) 약정끝나면 보통 현금받고 갈아타시나요? 요금이 싸지니 고민이네요.",<span><b>인터넷</b> 3년 약정이 끝났네요</span>
모두의공원,2014-04-16, 입니다 아침이라 그런걸까요.. 여지껏 테스트한것중에 제일 빠르게 나왔네요; 지역은 교대입니다 파일 추가 첨부 - 광대역으로 잡히네요 #CLiOS SK도 광대역인가봐요? 아이폰이면 LTE-A는 아닐텐데요.. 확인...,<span>오랜만에 아이폰 5s <b>인터넷</b> 속도 측정 해봤습니다</span>
모두의공원,2014-04-16,"제 갤럭시메가가 밝기50% 와이파이환경에서 ,(클리앙)만 쓰면서 배터리소모율인데. 4시간30분에 60%...자주 사용하는기기는 아이폰5S(,)와 갤럭시메가(LG) 아미레(,데이터함께쓰기) 정도입니다. 가장...",<span>안드로이드 최적화 (IOS와 비교하여)</span>
모두의공원,2014-04-15,"대기업이 , 바이럴 마케팅을 안한다고 생각하는게 말이 안된다고 봅니다만.. 저도 의심가는 분이 생기는거 같은데.. 한번 봐봐야겠네요/ 일랭님/ 찾으시면 저도 말해주세요. 궁금하네요. 뭐 따로 말씀드릴건...",<span>삼성 관련 최근 가장 시원했던 일.</span>
모두의공원,2014-03-20,"망이 죽었을까요 문자도 한참있다가 발신실패, 전화는 통화대기음도 없고 조용.. 이상한 날입니다 오후 3시까진 됬는데.. #CLiOS 전 회사에서 volte로 전화하고. 판교역 왔더니 신호없음.. 전화 , 다 죽었네요?",<span><b>sk</b> 진짜 <b>인터넷</b>만 되요</span>
모두의공원,2014-03-20,"과 TV결합상품을 살펴보니 온가족 프리인가가 저렴하더군요. 어머니와 아버지가 ,를 쓰고계셔서 저도 ,라서 3회선으로 하려고 했더니... 어머니껀 아버지 명의로 되어 있다는 군요. 그래서 방금 어머니껄...",<span>아... <b>인터넷</b> 신청 참 힘드네요...^^;</span>
모두의공원,2014-03-19,"다른통신사가 영업중지라.. from CV 전화 안되는건 정말 크네요.. 개통해지 하세요... 고갱님 집 , ,로 바꾸시면 중계기 달아드려요.......드립을 못들어보셧군요.ㅠㅠ 저도 같은 상황인데, 아파트에...",<span>skt상담원이랑 관리자에게 엄청 화냈네요</span>
모두의공원,2014-03-31,은 되는데 토렌트만!!! 왤까여 몇일전부터 계속 그러네요 토렌트 속도만 40kb 컴 문젠가 했더니 까페오니 또 잘됨 ㅜ 에잇 갈아타야지 #CLiOS 토렌트는 애초에 막기도 힘든데요.. 트래커추가가 안된거...,<span><b>sk</b>브로드밴드 토렌트가 안되네요</span>
모두의공원,2014-03-31,은 되는데 토렌트만!!! 왤까여 몇일전부터 계속 그러네요 토렌트 속도만 40kb 컴 문젠가 했더니 까페오니 또 잘됨 ㅜ 에잇 갈아타야지 #CLiOS,<span><b>sk</b>브로드밴드 토렌트가 안되네요</span>
모두의공원,2014-03-29,"구입 ,으로 알아보니 벌크 제품이 겁나 저렴... 아이폰을 끄고 26000원을 지켜낼 것인가 아니면 호사를 누릴 것인가 고민이네요ㅠㅠㅠㅠㅠㅠㅠㅠ #CLiOS 저라면 안 뜯습니다. 창돌씨님 그래야할까바요...",<span>라이트닝 젠더를 뜯을지 말지 고민중입니다</span>
모두의공원,2014-03-28,"잃을것도 얻을것도 없지만요. 바이두는 서서히 ,와 KT마저도 끊어서 그동안 모든 자료들을 기반으로 ""자료...저작권과 규제따위는 통할리없는 중국,이니까요. 진정한 자유가 있다면 아마 중국일겁...","<span>바이두는 LG를 일부러 막은것같고, KT와 SK도 머지않았다고 생각합니다.</span>"
모두의공원,2014-03-28,"KT와이파이로 업로드하니 1MB이상 나오네요. 직장에서 ,브로드밴드로 업로드하니.. LG정도는 아니지만 역시 업로드 속도가 다운되었습니다. , 만큼은 LG유플러스가 진리라고 생각했는데.. 이젠 아닙니다",<span>LG유플러스 <b>인터넷</b> 진리라고 생각했는데... 이젠 아닙니다.</span>
모두의공원,2014-03-28,"내가 오후 6시부터 6시간동안 겪었던 수발신 및 , 장애를 직접 겪었는데 내가 왜 보상대상에 포함이...일괄 1/30 보상으로 퉁치려 하는군요. 얼른 타통신사로 옮기고 ,는 쳐다보지도 않을랍니다 from CV",<span>skt 장애보상을 직접겪었는데 추가대상에 포함 안된답니다 : 클리앙</span>
모두의공원,2014-05-19,"공유기 사용하는거 ,나 kt한테 들켜도 되나요? skb는 별말 안하던데요.... 아질게요 KT도 별 신경 안쓰더군요. 아질게요 제목 : , 공급자 몰래 공유기 사용해보려구해요~ 내용 : 공유기 사용하는거 ,나...",<span><b>인터넷</b> 공급자에게 공유기 사용 걸리면 안되나요?</span>
모두의공원,2014-05-16,"이런 짓까지 하다가 걸려 벌금 물었는데 삼성과 ,는 호갱님들에게 돈 돌려줄 생각은 안해요. 이른바 ""삼성...이건희가 어떤 짓을 했는지 검색해보면 ,에 적잖게 공개되어 있습니다. 그냥 탈세 좀 하고...","<span>새소개 'SKT, 출고가 대거 인하…최대 40만원' 이해가 안되는 것이..</span>"
모두의공원,2014-03-11,"ㅋㅋ 제 정보는 유출되지 않았네요. 작년 7월 ,로 넘어왔는데. 그 이후에 털려서 없는것 같네요. 그런데...작년에 skt로 휴대전화 이동후 지금은 ,만 kt인데 이번에는 안털렸어요. 오늘 로또나...",<span>-</span>
모두의공원,2014-03-11,"가만 생각해보니 집에 있는 전화랑 ,도 KT였더라구요 이번 기회에 죄다 해지하고 바꿔버릴 생각입니다...때리는데 지네들은 네이트 왕창 털린거 기억 못하나봐요. 물론 ,'t'가 털린건 아니지만... #CLiOS",<span>명불허전 KT... 기본이나 똑바로하길</span>
모두의공원,2014-03-10,"있기때문에 쓸일도없는데... 답답하네요... , 끊어지고.티비 버벅거러려 해지후 위약금 25만원에 요금...끝고나니 열이 슬슬 올라오기 시작하네요... 혹 ,에서 분실했다고 청구 들어오면 어떻게 해야...",<span><b>sk</b> 브로디 밴드해지 했습니다. : 클리앙</span>
모두의공원,2014-04-15,"발매햇지만... ,에서 자사 인증 소프트웨어가 아니면 설치못하게 수정. 문제는 스마트폰 발매후 단종때까지 단 한개도 인증안해줌... 이게 당시 국내 스마트폰의 현실이였습니다. 그런식으로 설치 제한된 스마트...",<span>아이폰 없었다고 WiFi도 서드파티앱도 없었을거란건 과장이죠...</span>
모두의공원,2014-04-11,"전기차에 관심이 생겼어요 테슬라s 최고급형을 수입해와서 타보고싶어요. ,으로밖에 못알아봤는데 꽤나 굉장히 매력있네요 3g는 ,가서 개통해야하나;;; 수입불가같은건 아니겠죠?ㅎㅎ 리뷰 올릴께요...",<span>이번주에 로또되면 사고싶은게 생겼어요..</span>
모두의공원,2014-03-19," , 1년씩 재약정해서 월13000원까지 가격 협상했네요 상품권8만원도 받고요 그냥 귀찮아서 냅두면 할인도 못받고 호구되네요 __withANN＊ 약정 끝날때마다 뭔가 액션을 취해야 하더군요. 저는 제가 쓰는...",<span><b>인터넷</b>은 그냥 쓰면 호구되네요</span>
모두의공원,2014-03-17,"어짜피 친척지간이고 해서 큰이 통해서 폰을 바꿨는데..알고보니 ,텔링크라고 하는 별정통신사더라구요.. 그래서 아니 이런통 신사도 있나 ,을 찾아봤는데..정말 암담하더 군요...갑자기 짜증이 팍...",<span>아이고...이건 정말 철회가 답이겠죠??</span>
모두의공원,2014-03-17,"그 정도의 정보를 목적으로.. 설마 간첩을 보내겠습니까?? 아무리 ,이 발전했어도.. 온라인상에서 모든게 해결될까요? 예전에 ,컴즈 이사 한명수가 이런식의 말을 했죠..... 부하직원들에게 자료조사...",<span>근데 요즘 간첩 보낼 이유가 있나요</span>
모두의공원,2014-03-14,"것도 하루이틀이지. 방금 벌써 4번째 해지방어 전화가 오더군요. 정말 참다못해서, 절대 다시는 , , 사용하지않을거다. 충분히 상황설명하고, 이용할 수 없다고 했는데, 대체 4번이나 전화하는 게 말이...",<span><b>sk</b> <b>인터넷</b> 해지방어 너무 심하네요.. : 클리앙</span>
모두의공원,2014-03-13,"결혼하고 신혼집으로 (5층인 아파트) 들어갈 예정이라네요. 근데 들어갈 날을 앞두고 , 설치 할려고 , 설치를 불렀다네요. 근데 아파트 관리인이 옥상키를 주지 않아서 설치를 못했다고 기사 연락...",<span>이런일도 다 있네요. : 클리앙</span>
모두의공원,2014-03-13,"청량리 제기동 일호선 역들만 지나면 블랙스팟으로 ,이 멈추네요ㅠ from CV 구로-역곡 구간도 마찬가지입니다 ㅋ 강남-양재구간은 지상도 안되요.",<span><b>sk</b> 3g 블랙스팟많네요</span>
모두의공원,2014-03-26,"요즘 시골에 계신 어르신도 기지국도 빈약한데 3g하거나정 못쓰겠으면 2g lg 나 ,피쳐폰을 시드리죠 사실 진짜 잉여전화기죠 ,전화의 대역폭은 메신저를 쓰면 해결됩니다 시골에 전화드릴때는 전화가...",<span>셀프 홀로그램과 전화선으로도 되는 화상전화기가 있으니..</span>
모두의공원,2014-03-10,"막 성장하는 시기. KT가 아이폰 출시!!! SKT.. ""야 ,컴즈.. 아이폰용 네이트온 출시하면 죽어!!!"" ,컴즈...못했을뿐더러 윗분들 마인드 자체가 , 시장과 맞지 않는 마인드를 가지고 있으니.. 회사...",<span>SKT덕분에 컸지만 SKT 덕분에 망한 <b>SK</b>컴즈라고 봐야겠죠..</span>
모두의공원,2014-03-07,"번호이동 신청을 했습니다. ,은 타사를 사용하고 있구요. 그러자, 당일 오후에 ,(114)에서 귀신같이 , 가입 권유 전화가 오더군요. 아직 번호이동 완료가 된것도 아니고, 대리점에 신청서만 넣었을...",<span>솔직히 개인정보 유출건은 해킹 안당해도 업체들끼리는 공유하는거 아닌가요.</span>
모두의공원,2014-03-05,"며칠 후 이사인데 기존 , 5년 사용하고 당연히 무약정 상태인줄알고 타, 가입 후 사은품 확인하고 룰루랄라 ,브로드밴드에 해지신청 전화했더니 ""2011년 8월에 무선결합 할인 하셨죠? 그때부터...",<span><b>인터넷</b> 이전 설치 신청중인데 멘붕이네요... : 클리앙</span>
모두의공원,2014-03-04,"꽤 되네요 가조구할인으로 묶을 려구요 지금 , 및 티비 해지 비용을 보니 60만원! 1년 넘게 사용 했는데 해지 비용이...ㅜㅜ 아... 속상하네요 #CLiOS , tv단말쓰다가 유플로 오니 너무 좋더군요. 기존에...",<span>전 <b>인터넷</b> 및 티비 약정 끝나면 무조건 skt로 이동 할겁니다</span>
모두의공원,2014-03-04," 결합은 말구요. 순수 카드사를 통해 할인 박으시는거 있으세요. 국민카드사에 유플 관련 할인 카드 있어, 신규신청하려했더니. 영정중이라 불가하네요 . 지들이 잘못하고 영정 맞은거 땜시 통신할인 카도...",<span>통신비 할인.통신비 어떻게 줄이시나요.쩝 카드사 진짜</span>
모두의공원,2014-02-24,"개통 후 3개월간 월요금 1,000원이상 사용해 주셔야 합니다.. (제로콜 발생시 전화 사은품 환수) - , ,전화기 H535, WPS-6000 신청시 36개월 할부로 청구됩니다.(첫달3,000원 둘쨋달부터 2,900원) - KT...",<span><b>인터넷</b>은 오래사용하면 할수록 손해입니다.</span>
모두의공원,2014-02-24,"폐쇄되었다는게 문제네요 lg대리점에서 가입유치를 하면서 해지를 누락한것 같다고 합니다ㅠㅠ ,측 팀장급이나 소보원쪽에도 함 알아보세요. 아깝네요 100만원;;; 이건 누가봐도 가입자 잘못인데요. 제...",<span>우째 이런일이...도와주세요 ㅠㅠ</span>
모두의공원,2014-02-24,"아파트만 살아서 이런거 첨 봤습니다. 방으로 광케이블이 직접 들어오네요. ,브로드밴드인데.... 아마 망은 기가비트 망인데 100메가 제한을 거나 봅니다. 기가비트가 급 쓰고싶어지네요.. #CLiOS",<span>원룸에 <b>인터넷</b> 설치했는데 100Mbps가 넘네요.</span>
모두의공원,2014-02-23,"맨날 줬다가 손해다 싶으면 바로 도ㅗ 빼앗아바려서 참 싫죠... 그래서 이제 ,로 갈아탈려구요... 게티 안녕... 집전화, ,, 가족 묶음 이제 안녕... 이젠 가족 대 탈출 LG가 이 소식을 좋아합니다...",<span>KT 멤버십 '별' 할인 혜택 축소… 이용자 불만↑.gisa</span>
모두의공원,2014-03-13,"LG, 쓰는데 그것도 잠시 먹통이었어요.. 국가 통신망 자체가 이상증상이 있었던 모양입니다.. 북한한테 공격을 받았다거나..ㅎㅎ 제폰이 유플인데 지금까지 lte잘된거보면 그건 아닐거같아요... from CV...",<span><b>SK</b>만 먹통 증상이 아닙니다..</span>
모두의공원,2014-03-13,"이번에 이사한집에 kt광랜이들어와서 전부터사용하던 , 이전 설치하고 3일정도 지나고(케이티 설치때까지 기달리는 동안만 사용했죠ㅎㅎ) 해지할려고 전화했는데 처음 106번에서는 1년약정하면 한달에 얼마깍아...",<span><b>sk</b> <b>인터넷</b> 해지 재미있네요</span>
모두의공원,2014-03-11,"좀 업종이 달라보이는데.. 게임쪽에 진출했었나요? 제목... , 분야 & 게임 분야....라고 쓴... nhn엔터가 다음보다 높다니 #CLiOS ,플래닛은 빠져있네요. 스마일게이트 .... 저는 처음듣는데 크로스파이어...",<span>2013년 <b>인터넷</b>/게임기업 매출 TOP10.jpg</span>
모두의공원,2014-03-11,"소오름..ㄷㄷㄷㄷ 다털렷다 다털렷데 ,텔레콤~ 잘털렸다~잘털렸다~ 저도 이거 생각나더라구요 ㅋㅋㅋ 중국애들이 안전하게 지켜주고 있어요.. 스크+스트,이 요번에털렸다는데....에라잌ㅋㅋㅋ from CLiOS...",<span><b>sk</b> 고객이라면 개인정보 신경꺼두셔도 좋습니다.</span>
모두의공원,2014-03-11,"또다시 유출됐습니다. 10일 통신업계에 따르면 ,텔레콤과 LG유플러스, KT 등 이동통신 3사와 초고속 ,회사 ,브로드밴드 총 4곳에서 고객들의 개인정보가 유출됐습니다. 후략 2014/03/11 09:31 자 기사...",<span>왠 다른 유출 사건이.........</span>
모두의공원,2014-03-11,"10일 경찰이 ,텔레콤과 LG유플러스, KT 등 이동통신 3개사와 초고속 , 회사 ,브로드밴드 등 4곳에서 1500만건의 고객정보가 유출된 사실을 파악하고 수사에 나선 것으로 알려졌습니다.정보유출 고객 숫자...",<span>통신 3사 모두 털렸다..</span>
모두의공원,2014-03-25,"바꿔야겠죠....? 미칠광 랜 이네요 ㅎ ,보다 낫네요... ,비대칭 광랜ㅠ 폰인가요????ㄷㄷ;; 좀 심하네요...ㄷㄷ 2014년 맞지요..?..;;;헐;; 유플로 , 개통했는데 개통할 때 60메가 못넘으면 안...",<span>유플러스 광랜의 위엄.jpg</span>
모두의공원,2014-03-24,"확인해보세요. 교보에서 책 구매 기록 여부도 확인하시고요. from CLiOS 전 서울살고 ,만 10년쨍쓰는데 lg u+ , 쓴적도 없는데 계속 미납해지 문자오고 전화해서 항의하면 대전 안사냐고 헛소리나...",<span>이거 개인정보 도용당한걸까요...</span>
모두의공원,2014-03-04,"중고나라 뒤져아하는건지... 어, 다시 가봐야겠군요 맘에드시는 폰 있으시면..가보세용...^^ 지푸라기님//지금 ㅍㅇㅂ 아닌가요? 다들 요금제가 66,77 기본이죠 ? ㅠㅠ , 온가족 3회선 , 무료도 괜찮습니다",<span>스팟이 떠도 이넘의 할인 때문에 꼼짝을 못하네요</span>
모두의공원,2014-03-02,"밖에서 ,이 안되서 어? 왜 이러지? 하다가, 아 데이터 껐었지... 그런적도 있어요;;;;;;;;;; 저도 이랍니다 노트2도 가끔 그러더라구요ㅠ ＊ 제 노트3도 그럽니다. 비밀번호 들어가있는데도 설정 들어가서...",<span>갤놋3 와이파이 풀려서...</span>
모두의공원,2014-02-28,"아침에 클량에 어떤분이 할부원금 물어봤는데 , 접수랑 동일하다고만 알려준다해서 지금 저도 전화와서 물어봤는데 알려주더라구요 할원10이라고.. 대리점이 부산이던데 드디어 되나봅니다ㅠㅠ 저도...",<span>211대란때 올린거 <b>Sk</b>에서 전화왔는데</span>
모두의공원,2014-02-28,"SKT,+전화기 10%할인해서 한달 기본료 6.750원의 위력앞에서는 거의 무용지물입니다. 한달 휴대폰 요금이 1만원정도 이니. 한달 10만원 넘게 몇달동안 불필요하게 낭비되는것은 사실 별로더군요. 사용요금...",<span>대란이라도 SKT 6.750원 기본료 앞에서는 무용지물이네요...</span>
모두의공원,2014-02-28,"타기가 어렵네요.. 네 ,로 번이 하셨습니다. 크트는 제가 옮길라 했는데 저도 놓쳤네요~ ㅎㅎ 다음 타이밍...연락했더니 폰 전원이 꺼져있다네요 ㅠ #CLiOS ㅎㅎ 저도 뽐지랖은 하지 말라고 ,에서 많이",<span>갤럭시 액티브 어머니 태워드렸습니다.</span>
모두의공원,2014-02-27,"아무것도 할 수가 없었습니다 불안감까지 들더라구요 아 블베...살짝 아쉽네요 ,사용하고 bis신청해도 이메일만 된다뿐이지 ,은 bis안쓰는것보다 느립니다 ㅠㅠ 오에스10으로 넘어오세요. 푸쉬가 너무...",<span>블베 9900 넘 잘 사용중입니다</span>
모두의공원,2014-02-22,"쓸어담아 놓을 수 밖에... (3) 정말 폰기능과 아무런 연관이 없음에도 ,관련된 자회사들 앱은 다 탑재됐네요. 싸이월드, 11번가 이딴거요. 그냥 , 브라우저에 즐겨찾기 정도에만 넣었어도 덜 빡쳤지...",<span>SKT 갤럭시노트3 기본탑재앱 충격과 공포네요 ㄷㄷ 역대 최고인 듯...</span>
모두의공원,2014-02-20,"위약금이 좀 쎄다고 해서 고민하는 와중에 때마침 , 본사에서 전화가 오더라구요. 조금전 상담받으신 ㅇㅇㅇ 님이시죠? 하면서 ""원룸으로 이사하셔서 , 알아보고 계신 것 같은데... 반값요금제라고...",<span>원룸에 <b>인터넷</b> 어떻게 설치할까 알아보던 중 <b>SK</b> 본사에서 전화가 왔네요;</span>
모두의공원,2014-02-20,"통신사는 ,로요~ 통메 탑재 ＊ 애플의 케이블 내구성 #CLiOS ㅋㅋㅋㅋㅋㅋㅋㅋㅋㅋㅋㅋㅋㅋㅋㅋㅋㅋㅋㅋㅋㅋㅋㅋㅋㅋㅋㅋㅋㅋ 전면 통신사&제조사 로고 전면 상단 제조사이름 하단 제조사 로고 뒷면 통신사...",<span>최악의 스마트폰을 만들어봅시다.</span>
모두의공원,2014-02-19,조만간 이사도 있는데..ㄷㄷ;;; 기사아저씨 오실때까지 모뎀이나 셋탑박스 제가 평생 보관해야 하나봐요..ㅠ 전화가 안옴..ㅠ,<span>2개월전에...KT -&gt; <b>SK</b> <b>인터넷</b>과 티비를 옮겼는데.....KT측에서 장비를 아직도 안가지고 가네요..</span>
모두의공원,2014-02-18,"보고 오호라... 하고 마누라님은 스피커독 싸운드가 맘에 드신다고... SKB는 뭔배짱인지 그냥 막대기 ,전화로 버티는건지... ...하지만 온가족할인 50%의 한 축이라 변경은 못 하것고... -_-;;; 그 다른...",<span><b>SK</b> 브로드밴드는 <b>인터넷</b>전화단말기가 이리도 별로일까요</span>
모두의공원,2014-02-18,"해피콜은 안오고 skt 브로드밴드 본사 영업점에서 , 바꾸라는 전화만 오네요. 이자식들 그새 번호를...게 쉽지가 않네요. 헐..저랑 똑 같으시네요.. 그런데 저는 KT로 이동인데 ,에서 전화가..ㅎㅎ",<span>해피콜 기다리는 것도 쉬운게 아니네요.</span>
모두의공원,2014-03-11,"KT털렸죠. 옥션털렸죠.. kb/롯데/농협 털렸죠.. 저기 모두에 해당 안되시는 분 계시긴 하나요?? ,은 지역케이블 쓰고 핸드폰은 없거나 선불폰 쓰고 은행은 신한같은 아직 털리지 않았다고 하는데 밖에...","<span>우리나라 개인정보는 공공재가 맞네요; 이번엔 <b>SK</b>,KT,LG 통신삼사 모두 1500만건 유출..</span>"
모두의공원,2014-02-10,"시절부터 ,으로 핸드폰은 참 싸게 잘 샀었는데, 너무나 대중화 되면서 정보가 네이버 카페 같은데로 숨기 시작하더니 급기야 내방을 해야만 살 수 있게 되고.. 품을 더 많이 써야 되고, 더 많은 노력...",<span>좌표를 달라 하면 보내주긴 하던가요?</span>
모두의공원,2014-02-10,"건 ,이나 이 용어를 아는 친구들한테만 쓰죠 +1 from CLiOS 장난인데요 ㅎㅎ 사석이나, 커뮤니티 같은데서는 쓸 수 있죠. 흐드미라고. 예전에 회사에서 들은 ""이르다""가 생각나네요 ㅎㅎ 그것은 IrDA...",<span>근데 HDMI 흐드미라고들 읽으시나요?</span>
모두의공원,2014-02-08,"도통 보이질 않네요.. ㅡ.ㅡ; 베티아 8만이면 , (처음) 가입할 의지도 있는데 말이죠ㅋㅋㅋㅋ 근데 ,가...아니고... 저도 타고 싶은데 정보와 내방이 발목을 잡는군요 예전처럼 ,으로 하면 좋을테데.... TT",<span>사실 휴대폰대란이 나올수 밖에 없는 이유가</span>
모두의공원,2014-02-07,"지금 유쁠 쓰는데.. #CLiOS 그럴 땐 미친년 널을 뛰어줘야 하죠. ,도그래요 전 ,에서 그리 당했습니다... ㅎㅎ 전 옛날에 지역유선이랑 ,을 그런식으로 7년을 썼어요 ㅜㅜ 따지세요 ㅜㅜ from CV 전화...",<span>LG <b>인터넷</b> 얼척없네요. 1년만 더 써달라고 하고 3년 약정을 걸었네..</span>
